id,subject,name,units,term,description
CSUS_CSC 214,Computer Science,Knowledge-Based Systems,3 Units,"Fall, Spring",Historical perspective of knowledge-based systems and their relationship to artificial intelligence. Concepts of knowledge representation and automated reasoning. Survey of expert systems in a variety of applications in engineering and other fields. Implementation of expert systems and expert system shells. 
CSUS_CSC 215,Computer Science,Artificial Intelligence,3 Units,"Fall, Spring","Nature of intelligence and possibility of its realization on digital computers via algorithmic and heuristic programming methods. Knowledge representation. Search procedures. Problem-solving paradigms and simulation of cognitive processes. Machine learning. Natural language understanding, expert systems, and knowledge engineering. Image understanding. Future of artificial intelligence and limits of machine intelligence. "
CSUS_CSC 219,Computer Science,Machine Learning,3 Units,"Fall, Spring","Introduction to major paradigms and methods of machine learning. Inductive learning, explanation-based learning, classifier systems and genetic algorithms, analogical reasoning, case-based learning, connectionist learning, data driven approaches to empirical discovery, and basis of learning theory. Focus is on representative systems that have been built. "
CSUS_CSC 230,Computer Science,Software System Engineering,3 Units,"Fall, Spring","Integration of managerial and technical activities in system engineering that control  the cost, schedule, and technical achievement of the developing software system.  Application of the principles, activities, tasks and procedures of system engineering and software engineering to the development of a software system. "
CSUS_CSC 231,Computer Science,Software Engineering Metrics,3 Units,"Fall, Spring","Software quality and quantity metrics in software engineering.  Measurement theory and metrics.  Metrics include management metrics, indirect and direct metrics and predictive metrics.  Uses of metrics include software cost and schedule estimates, model calibration, and software productivity measurements.  Metrics techniques include the Goal-Question-Metric approach, COCOMO, and function point analysis. "
CSUS_CSC 232,Computer Science,Software Requirements Analysis and Design,3 Units,"Fall, Spring","Software engineering requirements including elicitation, analysis, specification, verification and management.  Emphasizes IEEE software engineering requirements and standards and the concept of operations (ConOps) document.  Techniques include structured analysis, use cases and object-oriented analysis. "
CSUS_CSC 233,Computer Science,Advanced Software Engineering Project Management,3 Units,"Fall, Spring","Advanced methods and procedures for managing a software development project.  Includes project planning, scheduling, and cost estimation, project organizational types, staffing and training considerations, leading and motivating computer personnel, and methods for measuring and controlling a project.  Emphasizes IEEE software engineering management standards and keys to project success. "
CSUS_CSC 234,Computer Science,Software Verification and Validation,3 Units,"Fall, Spring",Verification and validation (V & V) techniques to identify and resolve software problems and high-risk issues early in the software lifecycle.  Application of V & V to all phases of the lifecycle process.  Includes planning and reporting on the V & V effort.  Topics also include software quality assurance and software testing. 
CSUS_CSC 235,Computer Science,Software Architecture,3 Units,"Fall, Spring","Software architecture styles. Concepts and activities for software architecture design. Notations, models, and specification languages for software architecture design. Engineering discipline and guidance for software architecture design. Techniques, methods, tools for designing, building, analyzing, and evaluating software architecture. Object-oriented approach for software architecture design. Architecture-based software development. Management of software architecture design. Reuse of software architecture design. "
CSUS_CSC 236,Computer Science,Formal Methods in Secure Software Engineering,3 Units,"Fall, Spring","Basic concepts of formal methods in secure software engineering;  formal methods based software development models and methodologies; formal methods for software system specification, modeling, analysis, verification, information assurance and security; systems and tools for the application of formal methods in secure software engineering; advances of formal methods in secure software engineering. "
CSUS_CSC 237,Computer Science,Microprocessor Systems Architecture,3 Units,"Fall, Spring","Microprocessor/microcomputer architecture and hardware/software interfacing design. RISC v. CISC architecture in-depth, case studies of several popular commercial advanced 32-bit microprocessors. Microcomputer firmware architecture is discussed and illustrated with detailed examples. Term project in which students specify, design and build the hardware and firmware of a computer system. "
CSUS_CSC 238,Computer Science,Human-Computer Interface Design,3 Units,"Fall, Spring",Issues involved in design of interaction between people and computers. Insight and experience in key issues of HCI design. Emphasis on identifying issues and tradeoffs in interaction design. Development and evaluation of alternative solutions to design problems. 
CSUS_CSC 239,Computer Science,Advanced Operating Systems Principles and Design,3 Units,"Fall, Spring","Advanced concepts of concurrent processes, concurrent programming and operating systems. Virtual memory management systems, deadlock, file systems, operating system performance measurement and evaluation. "
CSUS_CSC 242,Computer Science,Computer-Aided Systems Design and Verification,3 Units,"Fall, Spring","Design and verification methodology using hardware description and verification languages (HDVLs). Advances in IC chip design; introduction to HDVLs such as System Verilog; HDVL language basics including data types, arrays, structures, unions, procedural blocks, tasks, functions, and interface concepts; design hierarchy; verification planning and productivity; verification infrastructure; guidelines for efficient verification of large designs; assertion-based verification; comprehensive computer-related design projects. "
CSUS_CSC 244,Computer Science,Database System Design,3 Units,"Fall, Spring","Topics in the design and implementation of database management systems. Database system concepts and architectures; query compiler, query processing algorithms, logical and physical query plans, query optimization; recovery, concurrency control; transaction management in centralized database management systems and distributed database management systems. Also exploration of current research directions, issues, and results related to databases and data management. "
CSUS_CSC 245,Computer Science,Performance Modeling and Evaluation,3 Units,"Fall, Spring",Performance and cost measures; software and hardware performance monitors; data reduction and evaluation; analytic and simulation models of hardware and program behavior; performance-cost trade-offs and resource allocation. 
CSUS_CSC 250,Computer Science,Computer Security,3 Units,"Fall, Spring","Principles and technologies behind computer security. Introduction to encryption and decryption; security mechanisms in computer programs, operating systems, databases, and networks; administration of computer security, and legal and ethical issues. "
CSUS_CSC 251,Computer Science,Principles of Compiler Design,3 Units,"Fall, Spring","Programming language translation, lexical analysis, syntax analysis including LR, LALR, and predictive techniques.  Semantic analysis including semantic specification.  Code generation and optimization including control and data flow analysis.  Storage management.  Error detection and recovery. "
CSUS_CSC 252,Computer Science,Cryptography Theory and Practice,3 Units,"Fall, Spring",Introduction to design and analysis of cryptographic systems.  Symmetric cryptography: block ciphers and secure hash functions.  Asymmetric cryptography: key exchange and public-key systems.  Authentication and encryption in an adversarial model.  Simple cryptanalysis.  Protocol design and analysis. 
CSUS_CSC 253,Computer Science,Computer Forensics,3 Units,"Fall, Spring",Structured security incident investigations internal and external; emphasis on analysis of electronic evidence and proper audit; utilization of scientific aids in obtaining information from computing devices; legal electronic evidence. 
CSUS_CSC 254,Computer Science,Network Security,3 Units,"Fall, Spring","In-depth study of network security problems and discussion of potential solutions.  Topics include: network vulnerabilities and attacks, secure communication, Internet security protocols and tools to defend against network attacks, network intrusion detection, and wireless network security.  Survey and demonstration of software tools used for network security. "
CSUS_CSC 255,Computer Science,Computer Networks,3 Units,"Fall, Spring","Computer networking fundamentals with emphasis on higher level protocols and functions. Network design considerations, software design and layering concepts, interface design, routing and congestion control algorithms, internetworking, transport protocol design, and end-to-end communication, session and application protocols. Specific examples of commercial and international standards. "
CSUS_CSC 258,Computer Science,Distributed Systems,3 Units,"Fall, Spring","Distributed system architectures, distributed object model,  component-based design, time and global states, coordination and agreement, distributed transactions and concurrency control, replication, security, distributed multimedia systems, message passing and distributed shared memory, Web services and Service-Oriented Architecture (SOA), Grid computing. Emphasis on scalability, manageability, security, and dependability of distributed systems. "
CSUS_CSC 273,Computer Science,Hierarchical Digital Design Methodology,3 Units,Cross Listed: EEE  273; only one may be counted for credit.,"Advanced logic modeling, simulation, and synthesis techniques.  Topics include modeling, simulation, and synthesis techniques, using Hardware Description Language (HDL's), Register Transfer Level (RTL) representation, high-level functional partitioning, functional verification and testing, computer-aided logic synthesis, logical verification and testing, timing and delay analysis, automated place and route process, and design with Application Specific Integrated Circuits (ASICs) and programmable logic. "
CSUS_CSC 275,Computer Science,Advanced Data Communication Systems,3 Units,"Fall, Spring","Fundamental concepts, principles and issues of data communication systems.  The ISO/OSI reference model is used as a vehicle for discussion and emphasizes the lower layer of the model.  Specific topics include:  motivation and objectives, layered architectures, physical layer principles and protocols, data link and medium access control principles and protocols, circuit, packet and cell switching, local area network design principles and performance comparisons, high speed networking, introduction to wide area network architectures.  Typical examples and standards are cited for point-to-point, satellite, packet radio and local area networks. "
CSUS_CSC 280,Computer Science,Advanced Computer Architecture,3 Units,; only one may be counted for credit.,"Introduction to parallel architecture covering computer classification schemes, fine and coarse grain parallelism, processor interconnections, and performance issues of multiprocessor systems.  Includes parallel and pipelined instruction execution, structure of multiprocessor systems, memory hierarchy and coherency in shared memory systems, programming issues of multiprocessor systems, arithmetic pipeline design, and design for testability. "
CSUS_CSC 288,Computer Science,Special Topics in Computer Science - Software Engineering,3 Units,"Fall, Spring",Contemporary topics in computer science will be offered as needed.   Topics offered:
CSUS_CSC 295,Computer Science,Fieldwork,1 - 3 Units, Faculty approval required. May be repeated for credit. ,Directed observations and work experience in computer science with firms in the industry or public agencies. Supervision is provided by the instructional staff and the cooperating agencies. 
CSUS_CSC 299,Computer Science,Special Problems,1 - 3 Units, May be repeated for credit. ,Any properly qualified student who wishes to pursue a problem of his own choice may do so if the proposed subject is acceptable to the member of the staff with whom he/she works and to his/her advisor. 
CSUS_CSC 500,Computer Science,Master's Thesis,1 - 5 Units, May be repeated for credit.  ,Completion of a thesis approved for the Master's degree. 
CSUS_CSC 502,Computer Science,Master's Project,1 - 2 Units,"Fall, Spring",Completion of a project approved for the Master's degree. 
CSUS_CM 9,Construction Management,Construction Surveying and Layout,3 Units,"Fall, Spring","Geomatics and the principles of surveying measurements for distance, direction, and elevation. Special emphasis on the application of surveying skills relevant to the field of construction, including building, bridge, and sitework layout techniques and procedures, establishment of reference line and grade, topographic mapping, and earthwork computations. Lecture two hours. Laboratory 3 hours. "
CSUS_CM 10,Construction Management,The Construction Industry,1 Unit,"Fall, Spring","Introduction to the Construction Management program and the many facets of the construction industry and to the various career opportunities. The unique products of construction, the organizations involved, and the people that make it happen. Guest speakers. Lecture one hour."
CSUS_CM 15,Construction Management,Fundamentals of Construction Management,3 Units,"Fall, Spring", may be taken concurrently.
CSUS_CM 20,Construction Management,Construction Materials and Processes,3 Units,Spring only,"Introduction to construction materials; to their properties in-place in completed projects, and to their characteristics that affect construction processes. The organizations, methods, equipment and safety considerations that are common to projects of all types and to all segments of the industry. Field trips. Lecture two hours; laboratory three hours. "
CSUS_CM 21,Construction Management,Construction Graphics,3 Units,Fall only,"Instruction and exercises in graphic techniques and procedures applicable to construction. Analysis of drawings in the civil, architectural, structural, mechanical, and electrical fields and how drawings affect construction planning. Freehand sketching. Isometric and oblique projections. Material quantity surveying.   Lecture two hours; laboratory three hours. "
CSUS_CM 22,Construction Management,Construction Documents,3 Units,Spring only,Analyzes construction contract documents. Technical and legal interpretations and implications to managers of the construction process. Quantity surveying. Lecture two hours; laboratory three hours. 
CSUS_CM 30,Construction Management,Engineering Mechanics--Statics,3 Units,Spring only,"Introduction to the solution of engineering design problems. Concepts of units, vectors, equilibrium, forces, force systems, shear and moment diagrams. Lecture three hours. "
CSUS_CM 40,Construction Management,Properties of Construction Materials,3 Units,Fall only,"Study of the engineering performance characteristics of materials. Covers testing concepts and procedures. Includes basic properties of metals, aggregates, cements, concrete, timber, asphalt, masonry and plastics with emphasis on construction applications. Lecture two hours; laboratory three hours. "
CSUS_CM 110,Construction Management,Legal Aspects of Construction,3 Units,Fall only,"Application of advanced legal concepts to the construction process. Analyzes problems relating to contract formation, administration, and interpretation. Includes bidding and contract enforcement; litigation of disputes vs. arbitration; liability for negligence, warranty, and strict liability; safety; license law requirements; mechanics' liens and stop notices; bond rights and obligations. Lecture three hours. "
CSUS_CM 111,Construction Management,Construction Labor Relations,3 Units,Spring only,"Study of federal and state labor law; labor unions, and their importance in the construction industry; and an analysis of the growth of open-shop construction.  Employment law. Lecture three hours."
CSUS_CM 120,Construction Management,Construction Operations and Methods Analysis,3 Units,Fall only,"Introduction to the analysis and management of construction projects in terms of the work that must be performed in the construction process. Analyzes operations and methods using concepts and techniques, including video, that are applicable to all types of projects in all segments of the industry, variables affecting productivity. Safety as an integral part of project and operations management. Field trips. Lecture two hours; laboratory three hours. "
CSUS_CM 121,Construction Management,Fundamentals of Construction Estimating,3 Units,Fall only,"Study of the basic approaches to estimating the cost of construction projects from a managerial viewpoint. Types of estimates and methods; elements of cost, variables and costing concepts; analysis procedures for detailed estimates. Lecture two hours; laboratory three hours. "
CSUS_CM 124,Construction Management,Engineering Construction,3 Units,Fall only,Study of engineering construction projects with emphasis on equipment-paced operations including safety aspects. Engineering fundamentals and other factors that affect equipment selection and production. Amplification of recording and analysis techniques. Unit price contracts. Field trips. Lecture two hours; laboratory three hours. 
CSUS_CM 125,Construction Management,Advanced Estimating and Bidding,3 Units,Spring only,"Study of the concepts and practices involved in the total estimating and bidding process in construction, from initial project selection to submission of final bids. Covers considerations in project selection, sub-bid analysis, contingency and risk analysis, pricing concepts, bidding models, and an introduction to computer applications. A complete project estimate and bid is prepared by each student. Lecture two hours; laboratory three hours. "
CSUS_CM 126,Construction Management,Construction Project Management,3 Units,Fall only,"Introduction to the study of Project Management as it is used on the larger construction project. Students study how construction contractors manage cost, time, scope, and quality. The theory of Project Management is developed and compared to management of the on-going business enterprise. Matrix and functional organizations are examined within the context of the industrial, commercial and heavy contract construction industries using the principles of the management process. Lecture three hours. "
CSUS_CM 127,Construction Management,"Planning, Scheduling and Control",3 Units,Spring only,"Study of the concepts used in planning and controlling construction projects. Arrow, PERT, precedence, and linear scheduling methods; resource leveling; time-cost analysis; bar charts; and time-scaled diagrams. Manual procedures followed by computer applications. Lecture three hours. "
CSUS_CM 129,Construction Management,Senior Project,3 Units,Spring only,"Consideration of technical, legal, business and human factors (including safety) in applying the functional approach to the management of construction organizations, projects, and operations. The individual construction professional in a competitive industry: personal and professional development, ethics, stress, physical and mental health. The industry and the construction professional in relation to the social and physical environments. Lecture three hours. "
CSUS_CM 130,Construction Management,Structures I -- Design Principles and Structural Steel Design,3 Units,Fall only,"Introduction to structural design. Consideration of load conditions, stresses, strain, beam deflection and column action. Basic design of structural steel members with emphasis on systems used in practical situations. Beams, trusses, and columns are designed using the Uniform Building Code as a reference and the results are shown on detailed drawings and sketches. Lecture three hours. "
CSUS_CM 135,Construction Management,Soils and Foundations,3 Units,Spring only,"Study of the properties and behaviors of soils used as materials in construction. Index and physical properties of soils including compaction; permeability, compressibility, and shear strength. Methods of laboratory and field tests. Principles of foundation design, pavements, embankments and temporary soil support systems for trenches and cuts. Lecture two hours; laboratory three hours. "
CSUS_CM 136,Construction Management,Principles of Mechanical and Electrical Engineering,3 Units,Fall only,"Basic principles of thermodynamics with application to heating, ventilating and air conditioning systems. Introduction to electrical circuits and circuit analysis with construction applications. Lecture three hours. "
CSUS_CM 140,Construction Management,Structures II -- Timber and Formwork Design,3 Units,Spring only,"Basic design of structural timber members with emphasis on systems used in practical situations. Beams, trusses, and columns are designed using the Uniform Building Code as a reference and the results are shown on detailed drawings and sketches. Application of engineering principles to satisfy construction requirements that are not designed or shown in typical construction documents. Includes analysis and design of concrete form systems, shoring, and falsework, and construction dewatering. Lecture three hours. "
CSUS_CM 150,Construction Management,Structures III -- Reinforced Concrete and Reinforced Masonry,3 Units,Fall only,"Basic design concepts of reinforced concrete and reinforced masonry design. Topics and examples include design of beams, slabs, columns and walls. Students are required to demonstrate drafting ability. Assignments include design and drawings of various structural systems. Lecture three hours. "
CSUS_CM 199,Construction Management,Special Problems,1 - 3 Units, Open only to students competent to carry on individual work. Admission to this course requires approval of an instructor and the program coordinator. ,Individual projects or directed reading. 
CSUS_CRJ 1,Criminal Justice,Introduction to Criminal Justice and Society,3 Units,"Fall, Spring","Reviews the problem of crime and the societal response to criminals. Institutions discussed are those intended to discover the crime and the criminal and those designed to deal with the criminal, the victim, and society, once the criminal has been labeled. Finally, the bureaucracy of crime and its measurement as a social phenomenon are discussed."
CSUS_CRJ 2,Criminal Justice,Law of Crimes,3 Units,"Fall, Spring","Introduction to the case method of studying criminal law. Understanding and correlating the common law crimes and substantive law crimes. Study and emphasis on the classification and nature of crimes, the requisite elements of the major common law felonies and criminal responsibility of various persons involved in crime."
CSUS_CRJ 4,Criminal Justice,General Investigative Techniques,3 Units,"Fall, Spring",Techniques involved in the investigation of crimes; interview of victims and witnesses; questioning of suspects; organization and procedure in the investigation of crimes; crime scene searches; surveillance; use of scientific aids; and sources of information.
CSUS_CRJ 5,Criminal Justice,The Community and the Justice System,3 Units,"Fall, Spring","Examines complex, dynamic relationships between communities and the justice system in addressing crime and conflict with emphasis on the challenges and prospects of administering justice within a diverse, multicultural population and the roles played by race, ethnicity, gender, religion, sexual orientation, age, social class, culture, and justice professionals in shaping relationships within the justice system. Special topics include crime prevention, restorative justice, and conflict resolution and pure justice."
CSUS_CRJ 21,Criminal Justice,First Year Seminar: Becoming an Educated Person,3 Units,"Fall, Spring",Introduction to the nature and possible meanings of higher education and the functions and resources of the University.  Designed to help students develop and exercise fundamental academic success strategies and to improve their basic learning skills.  Also provide students with an opportunity to interact with fellow students and the seminar leader and to build a community of academic and personal support.
CSUS_CRJ 101,Criminal Justice,Introduction to Criminal Justice Research Methods,3 Units,"Fall, Spring","Introduction to research methodologies used in the social sciences, with a special emphasis on those methods most often used in the study of crime and criminal behavior, police/court systems, and correctional institutions, policies, and programs.  Students will acquire the knowledge and skills necessary to understand, critically analyze and assess descriptive and quantitative research studies.  Topics include the roles of theory and ethics in research, hypothesis testing, and research design. "
