id,subject,name,units,term,description
CSUS_CE 170A,Civil Engineering,Principles of Environmental Engineering,3 Units,"Fall, Spring","Introduction to principles of environmental quality management. Environmental ethics. Physical and chemical principles affecting environmental quality. Water quality parameters, their importance, and natural processes that affect them. Environmental health and risk assessment. "
CSUS_CE 170B,Civil Engineering,Environmental Engineering Practice,2 Units,"Fall, Spring",Introduction to environmental engineering professional practices. Water and wastewater treatment processes. Solid waste management. Air quality parameters and management. Sustainability. 
CSUS_CE 171A,Civil Engineering,Soil Mechanics,4 Units,"Fall, Spring","Composition and properties of soils; soil classification; soil compaction; soil-water interaction, including permeability and seepage analyses; soil stresses; soil compressibility, consolidation, and settlement analysis; soil shear strength. Lecture three hours; laboratory three hours. "
CSUS_CE 171B,Civil Engineering,Soil Mechanics and Foundation Engineering,3 Units,Spring only,"Lateral earth pressures and principles of retaining wall design; slope stability analysis and principles of slope stabilization design; ultimate bearing capacity of soils, allowable bearing pressures and settlement of structures; principles of foundation design including shallow foundations and deep foundations. "
CSUS_CE 172,Civil Engineering,Design of Urban Water and Sewer Systems,3 Units,Fall only,Hydraulic design of water distribution and sewerage systems. Computer-assisted pipe network analysis. Analysis of pump systems. Pump station design. Other selected topics. 
CSUS_CE 173,Civil Engineering,Design of Water Quality Control Processes,3 Units,Spring only,"Analysis and design of selected physical, chemical, and biological facilities for water purification and wastewater treatment. Emphasis is on design based on loading factors and integration of unit processes into treatment systems. "
CSUS_CE 181,Civil Engineering,Geoenvironmental Engineering,3 Units,Not offered,"Equilibrium distribution of contaminants among air, water and solid phases of soil systems; analysis and modeling of soil vapor extraction (SVE), pump and treat, and soil washing systems; movement of gasses in landfills; infiltration through landfill cover; geosynthetic liner systems; hazardous waste containment systems. "
CSUS_CE 184,Civil Engineering,Geotechnical Earthquake Engineering,3 Units,Fall only,"Introduction to seismology and seismic hazard analysis; determination of building code design loads; prediction of soil-site effects; evaluation of liquefaction triggering, cyclic softening and associated consequences; introduction to mitigation techniques for liquefaction and ground failure hazards. "
CSUS_CE 190A,Civil Engineering,Civil Engineering Project Skills,3 Units, Student must have taken or be registered for 3 of the 5 core civil engineering courses ,"Introduction to professional engineering practice through case studies of existing projects, including estimating, scheduling, and specifications. Evaluation of design alternatives for engineering projects using principles of engineering economy and cost benefit analysis. Engineering ethics and professional responsibilities. "
CSUS_CE 190B,Civil Engineering,Senior Project,3 Units, This course must be taken in the final semester. ,Culminating degree requirement. Completion of a conceptual design and evaluation of alternatives under realistic constraints for proposed infrastructure projects. Students work in teams with practicing professionals providing mentoring. Draws upon full educational experience to date. Lecture two hours. Laboratory three hours. 
CSUS_CE 194,Civil Engineering,Career Development in Civil Engineering,1 Unit,", EEE194","Designed for Civil Engineering students making career decisions. Instruction will include effective career planning strategies and techniques including skill assessments, employment search strategy, goal setting, time management, interview techniques and resume writing. Lecture one hour. "
CSUS_CE 195,Civil Engineering,Fieldwork in Civil Engineering,1 - 3 Units, May be repeated for credit.  ,Supervised work experience in civil engineering with public agencies or firms in the industry. 
CSUS_CE 195A,Civil Engineering,Professional Practice,1 - 12 Units, Requires satisfactory completion of the work assignment and a written report.  ,Supervised employment in a professional engineering or computer science environment. Placement arranged through the College of Engineering and Computer Science. 
CSUS_CE 196M,Civil Engineering,Groundwater Engineering,3 Units,,"Principles of groundwater, and occurrence and movement of groundwater. Groundwater flow, Darcy's Law, solutions of steady and unsteady flow problems. Confined and unconfined aquifers, leaky aquifers, pumping test design, and groundwater management. "
CSUS_CE 199,Civil Engineering,Special Problems,1 - 3 Units, Open to students judged capable of carrying out individual work. Admission requires departmental approval and sponsorship of a supervising faculty member. Cannot be used as a technical elective in the major. Consult the CE Department for admission procedures and other requirements. May be repeated. ,Individual projects or directed reading. 
CSUS_CE 199E,Civil Engineering,Independent Study Technical Elective,3 Units, Open to only those students prepared and capable of carrying out independent work. Admission requires departmental approval and sponsorship of a supervising faculty member. Can be used as a technical elective in the major. Consult the CE Department for admission procedures and other requirements. May not be repeated for credit.  ,"Individual project, research, or directed reading on an advanced topic.  "
CSUS_CE 231A,Civil Engineering,Computer Methods of Structural Analysis I,3 Units,Fall only V even years,Flexibility and stiffness methods of structural analysis are applied to two- and three-dimensional framed structures. Use of computer software to perform analysis is discussed in detail. Techniques of computer modeling are discussed. 
CSUS_CE 231B,Civil Engineering,Computer Methods of Structural Analysis II,3 Units,Spring only V odd years,Continuation of CE  231A with extension of theory to allow for the analysis of a wider variety of structures. Structural analysis software is used for the analysis of three-dimensional structures. Fundamentals of the finite element method and computer modeling with applications to structural problems. 
CSUS_CE 232,Civil Engineering,Nonlinear Structural Analysis,3 Units,Spring only V odd years,"Theory and applications of nonlinear structural analysis including geometric and material nonlinear effects. Stability issues and second-order analysis methods in the context of moment amplification effects, member buckling, and the behavior of structural elements and frames undergoing large deformations. Inelastic material behavior and stress resultant plasticity concepts within a line-type element framework. Computer implementation of geometric nonlinear behavior. "
CSUS_CE 234,Civil Engineering,Dynamics and Earthquake Response of Structures,3 Units,Fall only V odd years,"Response of structures modeled as single-degree systems to harmonic, periodic, and arbitrary excitation and earthquake ground motion; effects of damping and material nonlinearity; numerical methods using spreadsheets; response spectra. Response of structures modeled as multi-degree systems: modeling of structure mass, damping and elastic stiffness; solution by modal superposition; time-history and response spectrum analysis; implications for codes for earthquake-resistant design. Microcomputer software is extensively used. "
CSUS_CE 235,Civil Engineering,Advanced Steel Design,3 Units,Spring only V even years,"Advanced design methodology of steel structures using Load and Resistance Factor Design (LRFD). System level behavior, especially from a seismic loading perspective, is integrated into the design of steel components and connections. Other topics include plate girder design, plastic design of indeterminate systems, design of moment frame systems, and design of braced-frame systems. "
CSUS_CE 250,Civil Engineering,Systems Analysis of Resources Development,3 Units,Spring only V even years,"Investigation of resource planning using the ""systems approach"". Objectives of resource development; basic economic and technologic concepts, and economic factors affecting system design. Consideration of evaluation, institutional constraints, and uncertainty in water resources systems. Familiarization with modern computer techniques. Applications of concepts to air and land resources. "
CSUS_CE 251,Civil Engineering,Water Resources Planning,3 Units,Fall only V odd years,"Application of single and multi-objective planning to the design and operation of water resources projects. Objectives and constraints for water projects, criteria and procedures for evaluation, planning under uncertainty.  Application in water development and water quality planning, with case studies. "
CSUS_CE 252A,Civil Engineering,Environmental Quality Processes I,3 Units,"Fall, Spring","Theory and practice of chemical processes affecting water quality. Chemical equilibrium, stoichiometry and kinetics of aqueous chemistry. Acid-base, precipitation-dissolution, oxidation-reduction, and coordination chemistry. Adsorption. "
CSUS_CE 252B,Civil Engineering,Environmental Quality Processes II,3 Units,"Fall, Spring",Theory and practice of biological processes for controlling water. Stoichiometry and kinetics of microbial growth. Aerobic and anaerobic metabolism. Engineered suspended and attached growth systems. Introduction to sludge treatment. 
CSUS_CE 252C,Civil Engineering,Environmental Quality Processes III,3 Units,"Fall, Spring","Theory and practice of physical and chemical processes used in engineered water and wastewater systems. Adsorption, ion exchange, gas transfer, membrane processes, coagulation, flocculation, sedimentation, filtration, precipitation, disinfection, and stripping. Physical/chemical reactors. "
CSUS_CE 254,Civil Engineering,Water Quality Management,3 Units,"Fall, Spring","Examination of pollution sources and effects on water bodies, and the management issues and tools used to protect environmental quality. Topics include point and nonpoint pollution sources, interactions in the environment, Federal and State laws, water quality objectives, beneficial uses, and regulatory mechanisms such as basin plans and total maximum daily loads (TMDLs). Emphasis is on surface water. "
CSUS_CE 255,Civil Engineering,Transport of Chemicals in Soil Systems,3 Units,"Fall, Spring","Study of the mechanics of movement of chemicals in soil, including equilibrium and partition models, development of mass transport equations in porous media, analytical solution for one-dimensional transport, lumped parameter transport model (linear reservoir model), transport of reactive and conservative chemicals numerical solutions of transport models, transport in the unsaturated zone and coupled models for saturated and unsaturated zone. "
CSUS_CE 261,Civil Engineering,Transportation Planning,3 Units,Fall only V odd years,"Introduction to the complexities of comprehensive intermodal transportation planning. Study of transportation problems, system operating characteristics, alternative modes, and the planning process.  Analyzes factors affecting travel behavior and methods of forecasting demand for travel by various modes. "
CSUS_CE 262,Civil Engineering,Advanced Transportation Facility Design,3 Units,Fall only V even years,"Advanced study of current topics in highway and mass transportation facility design including safety, curve design, pavement design and drainage facility design.  Focuses on current design practice and recent or impending changes in design practice. "
CSUS_CE 263,Civil Engineering,Traffic Flow Theory,3 Units,Fall only V even years,"Study of traffic flow characteristics including flow rate, speed, and density, at both the microscopic and macroscopic levels. Traffic flow analysis using the theoretical methods including capacity analysis, traffic stream models, shockwave analysis, and queuing analysis. Emphasis is on theory with demonstration of practical applications. "
CSUS_CE 265,Civil Engineering,Analysis and Control of Traffic Systems,3 Units,Fall only V odd years,"Traffic data collection and analysis, practical application of theoretical methods of analysis such as capacity, level of service, and queuing theory. Investigation of traffic control techniques such as actuated signals and signal systems, and study of management techniques for traffic congestion. "
CSUS_CE 266,Civil Engineering,Advanced Design in Reinforced Concrete,3 Units,Spring only V even years,Advanced topics in behavior and design in reinforced concrete.  Detailing for seismic response. 
CSUS_CE 267,Civil Engineering,Structural Systems for Buildings,3 Units,Spring only V even years,"Analyzes and design of various structural systems for buildings: frames, tubes, shear walls with or without openings and interaction between these types. Secondary effects such as P^, material and geometrical nonlinearities. "
CSUS_CE 268,Civil Engineering,Pre-stressed Concrete Bridge Design,3 Units,Fall only V even years,"Behavior and design of short and medium-span prestressed concrete bridges using American Association of State Highway and Transportation Officials (AASHTO) Load Resistance Factor Design (LRFD) specifications. Topics include: bridge types, aesthetics; design process; superstructure load types and live load analysis; limit states and load combinations; prestressed concrete materials; flexural analysis and design; shear analysis and design; and introduction to substructure analysis and design, including seismic design criteria. A team project is required. "
CSUS_CE 269,Civil Engineering,Pavement Design,3 Units,Spring only V even years,"Fundamental principles of pavement analysis, design, and evaluation. Topics include pavement materials, mechanics, traffic and environmental loadings, pavement performance, design methods, construction and economic evaluation. "
CSUS_CE 271,Civil Engineering,Modern Hydrologic Techniques,3 Units,Spring only V even years,"Analyses of hydrologic and meteorologic phenomena by mathematical, statistical, and system methods, linear and non linear, stochastic and parametric hydrology, computer applications in hydrology. "
CSUS_CE 272,Civil Engineering,Advanced Engineering Hydraulics,3 Units,Spring only V even years,"Steady uniform and non-uniform open channel flows including gradually, rapid and spatially varied flows; analysis of supercritical flow in transition; basic principles of unsteady flows; long wave theory; Saint-Venant Equations and their solutions including method of characteristics, explicit and implicit finite difference numerical methods. "
CSUS_CE 274,Civil Engineering,Hydrologic Modeling,3 Units,Spring only V odd years,Theories and structure of hydraulic model components; application of HEC-RAS (River Analysis System) and HEC-HMS (Hydrologic Modeling System) computer programs; emphasis on flood routing methods; dam safety analysis methodology including dam break and dam overtopping cases; application of microcomputers in hydraulics computations. 
CSUS_CE 276,Civil Engineering,Groundwater Hydrology,3 Units,Fall only V even years,"Occurrence and movement of groundwater; physical characteristics of aquifers; analysis of steady-state groundwater flow problems by mathematical, digital computer, electrical analog and graphical methods; analysis of unsteady-state problems in confined and unconfined, aquifers; multiple well systems. "
CSUS_CE 280A,Civil Engineering,Advanced Soil Mechanics and Foundation Engineering I,3 Units,Fall only V even years,"Advanced analyses in soil mechanics and their practical applications in foundation engineering; compressibility of soils, settlement analysis, and tolerable settlement; lateral earth pressures and design of earth retaining structures;  bearing capacity of shallow foundations; in-situ soil testing for foundation design; design of deep foundations, including driven piles, drilled shaft foundations, and laterally loaded piles. "
CSUS_CE 280B,Civil Engineering,Advanced Soil Mechanics and Foundation Engineering II,3 Units,Fall only V odd years,"Advanced analyses in shear strength of cohesionless and cohesive soils, including stress-strain characteristics of soils, total and effective stress analyses; slope stability analyses for natural slopes, fill slopes, earth dams, levees, and methods of slope stabilization; analysis and design of anchored bulkheads, cellular cofferdams, soil nail walls, tieback walls, mechanically stabilized earth walls, and segmental retaining walls.   "
CSUS_CE 280C,Civil Engineering,Geotechnical Modeling,3 Units,Fall only V even years,"Advanced analysis principles and procedures for calculating monotonic and cyclic soil element response effective stress and pore water pressure distributions, dynamic site response, and soil deformations; application to analysis of complex geotechnical engineering systems such as levees, dams, and wharfs. Laboratory time devoted to numerical analysis software and physical element and small scale tests. Lecture two hours. Laboratory three hours. "
CSUS_CE 283,Civil Engineering,Ground Modification Engineering,3 Units,"Fall, Spring","Principles of soil stabilization and earth reinforcement; mechanical compaction and treatment of difficult soils, including expansive soils, collapsible soils, oversize materials, and compressible fill; prefabricated vertical drains and preloading; dynamic deep compaction; vibro compaction; vibro-replacement; rammed aggregate pier; compaction grouting; jet grouting; slurry grouting; chemical grouting; deep soil mixing; slurry trench walls. "
CSUS_CE 284,Civil Engineering,Soil Dynamics and Earthquake Engineering,3 Units,Spring only V odd years,Introduction to vibration theory; wave propagation in soils and dynamic behavior of soils and foundations; dynamic tests; analysis of dynamically loaded foundations; causes of earthquakes; earthquake magnitude and zones; ground motions induced by earthquakes; earthquake-resistant design of foundations and earth dams. 
CSUS_CE 285,Civil Engineering,Geosynthetics I,3 Units,Fall only V even years,"Overview of geotextiles, geogrids and geonets; geosynthetic properties and test methods; geosynthetic functions and mechanisms as in separation, roadway and soil reinforcement, filtration, and drainage; applications and design methods; construction, fabrication and installation. "
CSUS_CE 286,Civil Engineering,Geosynthetics II,3 Units,"Fall, Spring","Overview of geomembranes, geosynthetic clay liners, and geocomposities.  Topics include:   geosynthetic properties and test methods; geosynthetic functions and mechanisms as in landfill liners, liquid barriers and carriers, erosion control, drainage, and design and construction methods. "
CSUS_CE 289,Civil Engineering,Project Management for Civil Engineers,3 Units,Spring only,"Theory and practice of project management in civil engineering. Interrelationship of planning, design, and construction. New technologies and techniques used in both US and international architectural/engineering/construction (A/E/C) markets.Topics: Project initiation, early estimates, project budgeting, work plans, design proposals, scheduling, tracking, design coordination, construction, project close-out, team and personal management skills, and quality control. "
CSUS_CE 296D,Civil Engineering,Stormwater Management,3 Units,"Fall, Spring","Principles and practices of stormwater management. Physical and chemical principles affecting stormwater quality, environmental effects, and treatment. Regulatory purposes and requirements for managing construction and post-construction runoff. Choosing and designing Best Management Practices. Erosion control. Hydrologic and hydraulic design of small drainage systems. Emphasis on California climatic and regulatory conditions. "
CSUS_CE 296H,Civil Engineering,GIS Applications in Civil Engineering,3 Units,"Fall, Spring","Introduction to fundamental concepts of geographic information systems (GIS), methods, and applications in civil engineering. Design and develop GIS-based analytical methods and solutions for civil engineering problems. Lab exercises are used to design and practice GIS applications in civil engineering. This course may be paired with CE 196H. "
CSUS_CE 299,Civil Engineering,Special Problems,1 - 3 Units, Approval of a petition must be obtained from the faculty supervising the work and the Department Graduate Program Coordinator. Letter grade or Credit/No Credit. ,Special problems in graduate research. 
CSUS_CE 500,Civil Engineering,Culminating Experience,3 - 6 Units,"Fall, Spring","Successful completion of either:  A.  Thesis (3-6 units), or B. Project (3-6 units) or  C.  Directed Study and Examination (3 units).  Plan A requires a thesis and is primarily research-orientated. Plan B requires a project report that is primarily application oriented. Plan C requires a detailed literature review or experimental data analysis resulting in a written report plus an examination by three faculty. A public presentation is required for all three plans. "
CSUS_CSAD 110,Communication Sciences and Disorders,Physics of Sound and Phonetics,4 Units,Fall only,"Physical production, acoustic characteristics of sounds of speech. International Phonetic Alphabet as applied to speech sounds; practice in phonetic transcription of dialects and deviant speech; applications in speech education, speech and hearing therapy. Introduction to physiological acoustics, psychoacoustics, and acoustic phonetics. Perception of speech including voice, resonance, individual speech segments; instrumentation for acoustic and perceptual analysis of speech. "
CSUS_CSAD 111,Communication Sciences and Disorders,Anatomy and Physiology of the Speech Mechanism,3 Units,Fall only,"Anatomical, physiological and neurological bases of speech. Covers development, normal structure and function. A general course in human anatomy is recommended as background. "
CSUS_CSAD 112,Communication Sciences and Disorders,Language Science and Development,3 Units,Fall only,"Overview and comparison of normal and abnormal child language development from infancy through upper elementary school.  Establishes a framework for understanding language disorders including autism and pervasive developmental delay.  Includes theories of language acquisition, basic principles of language sampling, systems of language, elements of grammar, and preparation for informal and standardized assessment of language disorders.  Introduces students to the impact of variables such as attention deficit disorder, poverty, bilingualism on developing language skills. "
CSUS_CSAD 120,Communication Sciences and Disorders,"Introduction to Language, Speech and Hearing Problems",3 Units,"Fall, Spring","Review of normal speech and language development. Overview of language, speech, and hearing development and disorders including multicultural issues.  Introduction to professional issues and ethics."
CSUS_CSAD 123,Communication Sciences and Disorders,Voice and Fluency,3 Units,"Fall, Spring","Fluency - Characteristics of stuttering, etiologic theories and their implications for treatment. Management of stuttering and other disorders of rhythm. Voice - Current concepts regarding anatomy and physiology, etiology, assessment and treatment of hyperfunctional and organic disorders. "
CSUS_CSAD 125,Communication Sciences and Disorders,Developmental and Acquired Neurogenic Language Disorders Across the Lifespan,3 Units,Spring only,"Language disorders and the dynamic, reciprocal relationships between the disability, the client, his/her family, and the environment. Developmental and acquired neurogenic language disorders from infancy through adulthood will be covered including neurophysiology and neuropathology. "
CSUS_CSAD 126,Communication Sciences and Disorders,Speech Sound Development and Disorders in Children: Aspects of Articulation and Phonology,3 Units,Spring only,Study of normal articulation and phonological development in children.  Discussion of etiologies and specific characteristics of articulatory-phonological disorders.  Introductory description of foundational specific assessment and treatment principles.  Analyzes case studies. 
CSUS_CSAD 127,Communication Sciences and Disorders,Introduction to Medical Speech Pathology,3 Units,"Fall, Spring","Current concepts regarding anatomy and physiology, etiology, assessment, and treatment of craniofacial disorders, laryngectomy, tracheostomy and dysphagia. "
CSUS_CSAD 130,Communication Sciences and Disorders,Audiology and Hearing Testing,3 Units,Spring only,Introduction to audiology; anatomy and physiology of the hearing mechanism; pathologies of the ear; basic acoustics of sound and its relation to hearing and speech; school hearing screening; hearing conversation; audiometric interpretation and its relationship to speech language and learning disorders. 
CSUS_CSAD 133,Communication Sciences and Disorders,Aural Rehabilitation,3 Units,"Fall, Spring","According to Tye-Murray, aural rehabilitation is ""intervention aimed at minimizing and alleviating the communication difficulties associated with hearing loss.""  This course examines communication assessment and remediation approaches for children and adults with both peripheral and central auditory problems. "
