id,subject,name,units,term,description
CSUS_ALS 57H,Arts and Letters,Academic Strategies - SSIS:,1 Unit, May be repeated for credit. ,Study skills supplemental instruction for selected General Education courses. Effective learning strategies for the academic course in which the student is concurrently enrolled.  
CSUS_ALS 70A,Arts and Letters,Strategies of Learning for EOP Students,1 Unit,"Fall, Spring","This course is designed to provide individual approaches to self knowledge, motivation, educational philosophy and skills necessary to give the student a firm foundation for a productive educational program during his/her college and post-college career.  The basic intent is to help the student perceive his/her position in the educational process, understand the necessity for succeeding, and learn how to succeed in college."
CSUS_ALS 79A,Arts and Letters,Developing Student Leadership EOP,1 - 3 Units,"Fall, Spring","The course is designed to provide students an opportunity to develop leadership skills that will serve them throughout their college career.  They will become familiar with the opportunities for leadership and growth at Sacarmento State.  Skills developed will include public speaking, team building, delegation, communication, and others."
CSUS_ALS 96,Arts and Letters,Academic Strategies: Experimental,1 Unit, May be repeated for credit. ,Study skills supplemental instruction for selected General Education courses or major courses. Effective learning strategies for the academic course in which the student is concurrently enrolled. 
CSUS_ALS 101,Arts and Letters,Texts Over Time,3 Units,"Fall, Spring","Drawing on selected texts from across at least two historical periods or cultural settings, students will refine their skills of textual appreciation and analysis with an eye toward enhanced understanding of the texts in their historical and cultural contexts."
CSUS_ALS 102,Arts and Letters,"Individual, Community, and Citizenship",3 Units,"Fall, Spring",This course examines the relationship between the individual and the community across at least two historical periods or cultural settings. Students will examine how perceptions of this relationship contribute to an understanding of belonging to or exclusion from political and social life.
CSUS_ALS 103,Arts and Letters,"Creativity, Meaning, and Criticism",3 Units,"Fall, Spring","This course examines the theoretical and practical bases that sustain the creative process, especially as it is engaged in the production and interpretation of meaning in the arts and literatures, as well as the foundation for their criticism."
CSUS_ALS 104,Arts and Letters,"Happiness, Well-Being and the Good Life",3 Units,"Fall, Spring","This course will examine the conditions and characteristics of living a good life, how happiness and well-being contribute to it, and its value as expressed in a range of human activities. Students will examine happiness, well-being and the good life in at least two historical periods or cultural settings."
CSUS_ALS 151,Arts and Letters,The Studio: Explorations in Arts and Letters,3 Units,"Fall, Spring","This course provides students with an opportunity to become informed and engaged participants in the cultural, artistic and literary dimensions of their communities. Students will explore the ways our experience of and appreciation for cultural products is informed by exposure to theory and practice in each of the Arts and Letters disciplines."
CSUS_ALS 195,Arts and Letters,Internship in Arts and Letters,1 - 3 Units,"Fall, Spring",Directed work experience in the internship program. Instructional staff and the cooperating agency provide supervision. 
CSUS_ALS 199,Arts and Letters,Special Problems,1 - 3 Units, Petition and faculty approval required; may be repeated for credit. ,Individual projects or directed study. 
CSUS_ASIA 96,Asian Studies,The Way of Chanoyu: An Interdisciplinary Approach to the Japanese Tea Gathering,3 Units,"Fall, Spring","This course traces the development of a multifaceted cultural practice integrating architecture, garden design, art, painting, and calligraphy into a carefully constructed hospitality ritual. Students explore multiple aspects of Japanese Chado via hands-on learning including aesthetic, economic, scientific, socio-political and cultural dimensions associated with tea. The course is taught in the Nakatani Tea Room, including weekly classroom lectures and discussions, demonstrations, on-line learning modules, a group project, and typically, a day field trip to San Francisco."
CSUS_ASIA 110,Asian Studies,Anthropology of Contemporary Asia,3 Units,,"This course examines contemporary Asia as an articulation of intersecting historical, cultural, political and economic processes. The course will focus on postcolonial developments and critically explore the manner in which process of globalization and neoliberal strategies embed themselves within, and the responses they elicit from societies across Asia. "
CSUS_ASIA 134,Asian Studies,History of Korea: Antiquity to Present,3 Units,Fall only,"This course traces the historical development of Korean culture from the period the Three Kingdoms to the present. In addition to the texts and records, other sources such as literature, religion, and art will be examined to gain an understanding of and appreciation for the longevity of Korea as a culture and a polity."
CSUS_ASIA 135,Asian Studies,Contemporary Korean Culture,3 Units,Spring only,"This course provides a comprehensive understanding of Korean culture and society through the analysis of contemporary Korean popular media. By critically examining the particular cultural phenomenon of the Korean Wave, this course upholds various Korean popular media (film drama, documentaries, and music) as significant forms of visual culture, which reflect as well as shape the reality of people's everyday lives both within and outside Korea."
CSUS_ASIA 136,Asian Studies,Korean Development and Behavior,3 Units,,"This course examines critical issues in Korean human development and behavior with particular attention given to current theoretical perspectives within a fast developing society. Topics include identity, cognitive development, mental health, tiger parenting, gender roles, socio-emotional development, body image, and transracial adoptions. This course integrates an interdisciplinary approach and includes indigenous discourse on Confucianism and Eastern and Western thought to understand the underlying processes of the Korean heritage person as an individual and as a member of a larger society."
CSUS_ASIA 140,Asian Studies,Modern East Asian Cinema.,3 Units,; only one may be counted for credit.,"Survey of the development of cinema in Asia, focusing primarily on cinematic masterpieces from China, Hong Kong, and Japan.  Focuses on directors, actors, and studios that left a lasting mark on cinema history.  Also focuses on how the Asian aesthetic sense differs from the Hollywood norm. "
CSUS_ASIA 151,Asian Studies,Genocide in Southeast Asia,3 Units,"Fall, Spring","Survey of human rights abuses and genocides that have occurred in post-colonial Southeast Asia. Focuses on mass killings in Indonesia and Cambodia and communal riots often targeting the ethnic Chinese community, religious minorities, or highland peoples like the Hmong. Topics include cultural genocide, ideological pressure, and ethnic intolerance. An interdisciplinary literature will interpret the causes and conditions while introducing students to the diverse societies and cultures of Southeast Asia."
CSUS_ASIA 195,Asian Studies,Internship: Asian Studies,1 - 3 Units,"Fall, Spring","Supervised work experience on topics related to the study of Asia's art, culture, economics, geography, environment, politics, and government and social issues."
CSUS_ASIA 198,Asian Studies,Asia in the World Today,3 Units,Spring only,"Senior seminar in recent scholarship and current issues concerning Asia in the world today.  A capstone course for Asian Studies majors, as well as graduate students interested in Asia. "
CSUS_ASIA 199,Asian Studies,Special Problems,1 - 3 Units,"Fall, Spring","Individual research projects, including directed readings, under the direction of an Asian Studies faculty person."
CSUS_ASTR 4A,Astronomy,Introduction to the Solar System,3 Units,Spring only,Description and explanations of astronomical phenomena and measurements related to the Solar System and exoplanets. Structure and evolution of planetary systems. Formation of solar systems and planets. Occasional observation periods. 
CSUS_ASTR 4B,Astronomy,"Introduction to Stars, Galaxies, and Cosmology",3 Units,"Fall, Spring","Description and explanations of astronomical phenomena related to stars, galaxies, and cosmology. Structure and evolution of stellar and galactic systems. Occasional observation periods. "
CSUS_ASTR 4C,Astronomy,Introduction to Astrobiology,3 Units,Fall only,Nature and history of scientific inquiry into life outside the Earth. Definitions of life. Habitability of planets and moons in our Solar System and of extrasolar planets. Likelihood of intelligent life outside Earth and rationale for the Search for Extra-Terrestrial Intelligence.  
CSUS_ASTR 6,Astronomy,Astronomical Observation Laboratory,1 Unit,"Fall, Spring, Summer","Study and use of various telescopes; field observation of planets, stars, meteors, asteroids, the moon and sun; laboratory activities relevant to astronomy. Lab three hours. "
CSUS_ASTR 131,Astronomy,The Solar System and Space Exploration.,3 Units, This course is approved as a Writing Intensive course.  ,"Planets and satellites, including their composition, structure, and atmospheres, with emphasis on modern techniques and observations. Solar surface phenomena and their influence on planets through the solar wind. Comets, meteorites, and their implications for the origin and evolution of planets. Physical effects governing feasible forms of space exploration and colonization. "
CSUS_ASTR 132,Astronomy,"Stars, Galaxies and Cosmology.",3 Units, This course is approved as a Writing Intensive course.  ,Types and evolution of stars; structure and evolution of galaxies; overall structure of the universe; current developments in astronomy. 
CSUS_ASTR 150,Astronomy,Dark Matter and Dark Energy,3 Units,Spring only V odd years,"Introduction to historical, observational and theoretical principles of dark matter and dark energy in the Universe. Topics will include dark matter in galaxies (rotation curves, stellar motions), dark matter in clusters (virial theorem, x-ray observations), MACHOs and WIMPs as dark matter candidates, as well as the discovery of dark energy through supernovae observations, and additional probes of  dark energy. Dark matter and dark energy will be discussed in the cosmological context of the Big Bang theory. "
CSUS_ASTR 199,Astronomy,Special Problems,1 - 2 Units, Open only to students competent to assume individual work on approval of the instructor.  Up to 2 units may be taken for a grade. ,Individual projects or directed reading. 
CSUS_ATIC 61,Athletics,Men's Cross Country,2 Units,"Fall, Spring",Practice begins mid-August and the season ends in mid-November. 
CSUS_ATIC 62,Athletics,Men's Tennis,2 Units,"Fall, Spring",Practice begins the first day of the fall semester and the spring schedule ends the last of May. 
CSUS_ATIC 63,Athletics,Men's Track and Field,2 Units,"Fall, Spring",Indoor Track and Field practice begins in the fall. The competitive season is in the winter. Outdoor Track and Field practice begins the first day of spring semester and the season ends the last week of May. 
CSUS_ATIC 64,Athletics,Men's Baseball,2 Units,"Fall, Spring",Practice begins in the fall with the competitive season starting February 1. The 56-game schedule is followed by the NCAA Championships for qualified teams in May. 
CSUS_ATIC 65,Athletics,Men's Basketball,2 Units,"Fall, Spring",Practice begins mid-October. The season ends in late February and leads to NCAA Championships for qualified teams. 
CSUS_ATIC 66,Athletics,Men's Football,2 Units,"Fall, Spring",Daily afternoon practice begins in late August. The 10-11 game schedule is followed by NCAA Championships for qualified teams in late November. There is also spring practice which follows NCAA regulations as to starting date. 
CSUS_ATIC 67,Athletics,Men's Golf,2 Units,"Fall, Spring",Practice begins fall semester Monday through Friday starting at noon. 
CSUS_ATIC 68,Athletics,Men's Soccer,2 Units,"Fall, Spring",Morning and afternoon practices begin in mid-August in accordance with NCAA regulations. Competitive season begins the first week of September and ends in mid-November. Daily practices during fall semester are from 3:00-6:00 p.m.  Daily practices during the spring semester are also from 3:00-6:00 p.m. beginning the third week in February and ending the last week in April.  You must see the head coach for permission to tryout. 
CSUS_ATIC 80,Athletics,Women's Basketball,2 Units,"Fall, Spring",Practice begins mid-October. The competitive season begins in November and continues to the end of February leading to the NCAA Championships for qualified teams. 
CSUS_ATIC 81,Athletics,Women's Golf,2 Units,"Fall, Spring",Practice begins the second week of September. Competition consists of one or two matches in the fall and the remaining part of the schedule is during the spring semester. Interested student-athletes who would like to walk on and try out for the team should contact the coach. 
CSUS_ATIC 82,Athletics,Women's Soccer,2 Units,"Fall, Spring",Morning and afternoon practices begin in mid-August in accordance with NCAA regulations. Competitive season begins the first week of September and ends in mid-November. Daily practices during fall semester are from 2:00-4:00 p.m. 
CSUS_ATIC 83,Athletics,Women's Gymnastics,2 Units,"Fall, Spring",Practice begins in September. The competitive season starts in January and ends in late April with the NCAA Championships for qualified teams. Daily practices are 12:30-4:00 p.m. Student-athletes must contact the coach prior to tryouts. 
CSUS_ATIC 84,Athletics,Women's Softball,2 Units,"Fall, Spring",Practice begins in the fall with the competitive season starting mid-February. The 56-game schedule is followed by NCAA Championships in late May for qualified teams. Daily practices are 1:30-5:30 p.m. 
CSUS_ATIC 85,Athletics,Women's Rowing,2 Units,"Fall, Spring","Rowing accommodates both scholarship and walk-on athletes with no experience necessary. Tall cross-over student-athletes are encouraged to turn out. Daily practice starts in September, 6:00-8:30 a.m. There is a fall semester long distance race season and a traditional ""sprint"" season in the spring semester, concluding with the National Championships in May.  All student-athletes race.  No limit on squad size.  Freshman/Novice, Junior Varsity and Varsity squads, lightweight (130 lbs.) or open.  Also, coxswains required.  Should be under 115 lbs. "
CSUS_ATIC 86,Athletics,Women's Tennis,2 Units,"Fall, Spring",Practice begins the first day of the fall semester and the spring schedule ends the last of May. 
CSUS_ATIC 87,Athletics,Women's Volleyball,2 Units,"Fall, Spring","Preseason begins in mid-August. Competition begins September 1 and ends in mid-December with NCAA Championships for qualified teams. Daily practices are 2:00-5:00 p.m. Interested student-athletes must contact the coach prior to the preseason, be cleared by the Clearinghouse, and meet all eligibility requirements in order to participate in tryouts. "
CSUS_ATIC 88,Athletics,Women's Cross Country,2 Units,"Fall, Spring",Practice begins mid-August and the season ends in mid-November. 
CSUS_ATIC 89,Athletics,Women's Track and Field,2 Units,"Fall, Spring",Indoor Track and Field practice begins in the fall. The competitive season is in the Winter. Outdoor Track and Field practice begins the first day of spring semester and the season ends the last week of May. 
CSUS_ATIC 167,Athletics,Coaching of Football,3 Units,"Fall, Spring","Examines all phases of the game, including offense, defense and special teams. Other topics covered are public/media relations, budget management, academic rules, marketing strategies, officiating, equipment and many other aspects. Lecture two hours, activity two hours."
CSUS_ATIC 175,Athletics,Sports Information Fieldwork,1 - 3 Units, May be repeated once for credit.  ,Directed observations and work experience with intercollegiate athletics sports information support services. Field work is offered to give students orientation in the profession of sports information services. Supervision is provided by the instructional staff of the university.  Each student is required to maintain a record of activities and assignments and to prepare periodic reports. 
CSUS_ATIC 195,Athletics,Field Experience in Intercollegiate Athletics,1 - 3 Units, Registration requires prior approval of Director of Athletics. ,Directed experience in athletics. Student interns keep records of daily experiences and prepare periodic progress reports. Succeeding enrollments should be in different sports. 
CSUS_ATIC 199,Athletics,Directed Individual Study,1 - 3 Units, Registration requires approval of the faculty under whom the individual work is to be conducted and the Director of Athletics. ,"Individual research, project or directed reading. "
CSUS_BIO 1,Biological Sciences,"Biodiversity, Evolution and Ecology",5 Units, Field trips may be required. ,Introduction to properties of life and cells leading to genetic and biological diversity. Survey of biological diversity emphasizing variation leading to natural selection; introduction to ecological concepts within an evolutionary framework; a survey of ecosystems and global climate change. Development of scientific skills will be emphasized. Designed for science majors. Lecture three hours; laboratory three hours; activity two hours; fee course. 
CSUS_BIO 2,Biological Sciences,"Cells, Molecules and Genes",5 Units,"Fall, Spring","Introduction to molecular and cellular biology and genetics. Topics include biomolecules, cell structure and function, cellular energetics, molecular flow of information, cell division, and genetic inheritance. Development of scientific skills and a scientific mindset will be emphasized throughout the course, particularly in lab exercises and activities. Designed for science majors. Lecture three hours; laboratory three hours; activity two hours. "
CSUS_BIO 7,Biological Sciences,Introduction to the Science of Biology,4 Units,"Fall, Spring","Introduction to major concepts of biology, including properties of living things, cells and their molecular constituents, the unity and diversity of organisms, genetics, ecology, evolution, and the scientific methods of investigation employed by biologists.  Satisfies requirements in biology for students planning to obtain the Multiple Subject Teaching Credential.  Lecture three hours; laboratory three hours. Fee course."
CSUS_BIO 9,Biological Sciences,"Our Living World: Evolution, Ecology and Behavior",3 Units,. ,"Designed for non-majors, this course is an introduction to the biological science behind important issues that face us today, such as those surrounding evolution, endangered species, conservation of ecosystems, and the behavior of organisms. By gaining an understanding of the scientific approach and the principles of evolution, ecology and behavior, students will be equipped to evaluate scientific developments and arguments in these and other issues as informed citizens. Lecture three hours. "
CSUS_BIO 10,Biological Sciences,Basic Biological Concepts,3 Units,. ,"An intensive introductory course for non-majors who will take additional course work in biology or related disciplines, including the allied health sciences. Introduction to the biological sciences with strong emphasis on cellular structure and metabolism, molecular biology and genetics, as well as concepts and principles common to all living systems including ecology and evolution. Lecture three hours. "
CSUS_BIO 15L,Biological Sciences,Laboratory Investigations in Biology,1 Unit,.  ,"Introductory laboratory investigation of the major principles of biology, including properties of all living things, the unity and diversity of organisms, structure and function of cells, energy and metabolism, genetics, ecology, evolution, and the scientific methods of investigation employed by biologists. Laboratory three hours. "
CSUS_BIO 20,Biological Sciences,Biology: A Human Perspective,3 Units,. ,"Introduction to biological concepts with emphasis on their application to humans. Topics include: Evidenced-based decision making with respect to food, nutritional supplements, drugs, pathogens, and biotechnology. How heredity and evolution contribute to our understanding of personality, sex, behavior, addiction, disease, and aging is also discussed. Lecture three hours. "
CSUS_BIO 22,Biological Sciences,Introductory Human Anatomy,4 Units,"Fall, Spring",Introduction to the study of the gross and microscopic structure of the human body using a systemic approach. Lecture three hours; laboratory three hours. Fee course. 
CSUS_BIO 25,Biological Sciences,Human Anatomy and Physiology I,4 Units,", or an equivalent combination of separate anatomy and physiology courses. Lecture three hours; laboratory three hours. Fee course. "," offers basic terminology and concepts pertaining to the disciplines of anatomy and physiology, including structure/function relationships, homeostasis, and organizational levels; and provides an introduction to the structure and function of the muscular and nervous systems. "
CSUS_BIO 26,Biological Sciences,Human Anatomy and Physiology II,4 Units,", or an equivalent combination of separate anatomy and physiology courses. Lecture three hours; laboratory three hours. Fee course.  "," provides an introduction to the structure and function of the cardiovascular, respiratory, renal and digestive systems, and emphasizes homeostatic control mechanisms. "
CSUS_BIO 30,Biological Sciences,Anatomy & Physiology - Brief Course,4 Units,"Fall, Spring","An overview of the basic anatomy and physiology of all systems. Designed to meet the standards for the Physical Education Subject Matter Program, but may also may prepare students for study in other health-related fields. "
CSUS_BIO 39,Biological Sciences,Microbiology for Allied Health Students,4 Units, Does not satisfy microbiology requirement for Biological Sciences majors.  ,"Introduction to micro-organisms, particularly bacteria and viruses, with emphasis on health care-related applications of microbiology using case studies. Laboratory work includes aseptic techniques, methods of cultivating and identifying bacteria, demonstration of microbial properties and will provide practice with basic microbiological skills. Lecture three hours; laboratory three hours. Fee Course. "
CSUS_BIO 100,Biological Sciences,Introduction to Scientific Analysis,2 Units,  ,"Covers anatomy of scientific literature, reading and writing scientific papers, proper citation formats, basic interpretation of tables and figures, graphical analysis, basic statistical analysis, experimental design to effectively test a hypothesis, and effective presentation of an experiment. Lecture one hour. Activity two hours. "
CSUS_BIO 102,Biological Sciences,The Natural History of Plants,3 Units,"Fall, Spring",. Lecture one hour; laboratory six hours. Fee course. 
CSUS_BIO 103,Biological Sciences,Plants and Civilization,3 Units,"Fall, Spring","Study of the significance of plants in the development of human civilization. Emphasis will be placed on the botanical, sociological and economic aspects of plants useful to humans. Lecture three hours. "
CSUS_BIO 104,Biological Sciences,Physiology of Human Reproduction,3 Units,Spring only,"Study of the physiology of human reproduction. Topics to be covered include: gametogenesis, the basis of fertility, conception, prenatal development, parturition, lactation and the physiology of contraception. Lecture three hours. "
CSUS_BIO 105,Biological Sciences,Life in the Ocean,3 Units,,"Study of marine life and ocean ecosystems. Exploration of the unique adaptations of marine life, how marine organisms interact with their environment, diversity of marine habitats from coral reefs to deep sea, and conservation. Does not count toward the Biological Sciences Major."
CSUS_BIO 106,Biological Sciences,Genetics: From Mendel to Molecules,3 Units, recommended. ,"Introduction to the principles of genetics and scientific approaches used to define those principles. The physical basis of heredity, the impact of selective breeding and genetic engineering will be discussed. Lecture two hours; discussion one hour. "
CSUS_BIO 109,Biological Sciences,Biology of Dinosaurs,3 Units,,"Introduction to the biology of the dinosaurs. Dinosaurs came in a vast array of shapes and sizes and exemplify biodiversity. This course will examine the dinosaurs in an evolutionary framework, discussing their origin, the major lineages, phylogeny and what they look like today. The course will take advantage of the recent surge in scientific investigations into the biology of dinosaurs, such as parental care, sexual selection, group living, flight and feathers. Does not count toward the Biological Sciences Major."
CSUS_BIO 112,Biological Sciences,Plant Taxonomy,4 Units,Spring only,Spring flora of central California is used as the focus of study in the classification and identification of native vascular plants. Lecture two hours; laboratory six hours. Field trips may be required. Fee course. 
